{
  "$schema": "https://github.com/getgleipnir/agent-security-review/schema/answers.schema.json",
  "kit": "agent-security-review",
  "kit_version": "0.3.0",
  "vendor": "",
  "product": "",
  "completed_by": "",
  "date": "",
  "status_values": {
    "evidenced": "Evidenced: we can show it today",
    "partial": "Partly: some evidence, gaps remain",
    "policy_only": "Policy only: a statement, no proof",
    "missing": "Not in place",
    "not_applicable": "Not applicable"
  },
  "answers": [
    {
      "id": "ACC-01",
      "question": "What actions can your agent take in our systems, and how are those permissions enforced at the moment a tool is called?",
      "status": "",
      "answer": "",
      "evidence_links": [],
      "template_answer": "The agent can call [N] tools: [list tool, target system and allowed operations, e.g. \"issue_refund on Stripe, up to EUR 200 per refund\"]. Each call passes through [enforcement layer, e.g. a tool gateway] that checks [allowlist, parameter limits, scoped credential] before execution; calls outside scope are blocked and logged. We test this in [CI suite / quarterly test], last run [date], results attached. Each action record stores the scope that applied (sample attached)."
    },
    {
      "id": "ACC-02",
      "question": "For every write in our systems, which identity performed it? Which agent and version, under which credential and scope, on whose behalf?",
      "status": "",
      "answer": "",
      "evidence_links": [],
      "template_answer": "Each deployment uses a dedicated identity, [identity name / service principal], which appears in your [system] audit logs. Every action record contains agent ID, agent version, credential ID (never the secret), scope, and the initiating [user / case / ticket] ID. Credentials are held in [vault / KMS] and injected per call; the model never sees them. A sample record joined to your system log is attached."
    },
    {
      "id": "ACC-03",
      "question": "What stops prompt injection or a manipulated tool chain from causing the agent to take an action in our systems?",
      "status": "",
      "answer": "",
      "evidence_links": [],
      "template_answer": "Untrusted content ([emails, documents, web pages, tool outputs]) is kept separate from instructions by [method]. Before any tool call, [validator] checks tool choice and parameters against [policy]; the model cannot bypass it. Our last red-team exercise on [date], by [internal team / third party], covered direct and indirect injection; a summary is attached. Unusual actions are flagged by [rule / monitor]."
    },
    {
      "id": "ACT-01",
      "question": "For any single agent action, can you produce the complete record? What triggered it, which inputs and sources it used, the exact tool call and arguments, the system's response, and the downstream effect.",
      "status": "",
      "answer": "",
      "evidence_links": [],
      "template_answer": "Every action produces one record containing: trigger ([event / user request]), inputs and retrieved sources, tool name and arguments (with [fields] redacted), the target system's response, timestamps and trace ID. We can export the full record for any action or case within [time]. A redacted example for one real case is attached."
    },
    {
      "id": "ACT-02",
      "question": "Which model and version handled a given action, including actions served by versions you have since retired?",
      "status": "",
      "answer": "",
      "evidence_links": [],
      "template_answer": "Each action record stores model provider, model name and pinned version, e.g. [example]. We keep a model inventory including retired versions and their active dates ([link / attachment]), so any past action can be matched to the model that handled it."
    },
    {
      "id": "ACT-03",
      "question": "Show every model endpoint and external service the agent actually called for our traffic, not just the list in your inventory.",
      "status": "",
      "answer": "",
      "evidence_links": [],
      "template_answer": "Each action record lists the outbound calls made: [provider, endpoint, region]. Every [month / quarter] we compare actual destinations for your traffic with the declared sub-processor list and share the result. The latest comparison is attached."
    },
    {
      "id": "ACT-04",
      "question": "Which documents and records contributed to each answer or action?",
      "status": "",
      "answer": "",
      "evidence_links": [],
      "template_answer": "For each answer or action we store the IDs and versions of the sources used ([document IDs, record IDs]). Retrieval runs under [the requesting user's permissions / a scoped identity], so the agent only sees what [that user / that scope] is entitled to. An example record with sources is attached."
    },
    {
      "id": "ACT-05",
      "question": "What is the lineage of the data used in a decision? Where did each input come from, and how current was it?",
      "status": "",
      "answer": "",
      "evidence_links": [],
      "template_answer": "For [use case], inputs come from [sources]. A data-flow diagram is attached. With each decision we store the source and retrieval time of every input, so you can see how current the data was at the time."
    },
    {
      "id": "ACT-06",
      "question": "For an adverse decision, can you give the specific reasons and the data relied on? A proprietary model is not an acceptable reason to withhold them.",
      "status": "",
      "answer": "",
      "evidence_links": [],
      "template_answer": "For each decision we store reason codes ([list or link]) and the specific inputs relied on. An explanation for an individual adverse outcome is generated from that stored record, not reconstructed later. A redacted sample is attached."
    },
    {
      "id": "ACT-07",
      "question": "For customer-facing agents, can you show per interaction that the conduct rules for our use case were met, such as AI disclosure, contact-time windows and contact-frequency limits?",
      "status": "",
      "answer": "",
      "evidence_links": [],
      "template_answer": "For each interaction we record the AI disclosure given ([wording]), the time in the customer's time zone, the contact-frequency count at that moment, and the version of the rule set applied ([rule set]). An export for a sample of [N] interactions is attached."
    },
    {
      "id": "OUT-01",
      "question": "When the agent says it did something, how do you know it actually happened in our system, as described?",
      "status": "",
      "answer": "",
      "evidence_links": [],
      "template_answer": "Each action record stores both what the agent reported and the response from [target system] (status, object ID, returned values). For [high-impact actions, e.g. refunds] we also read the object back from [system] and record match or mismatch. The mismatch rate for [period] was [x] ([report attached])."
    },
    {
      "id": "OUT-02",
      "question": "How do you detect and report actions that failed, only partly completed, or produced a different result than intended?",
      "status": "",
      "answer": "",
      "evidence_links": [],
      "template_answer": "Failed, partial and mismatched actions are counted and included in your [monthly] report with examples. Alerts fire at [threshold] and go to [owner]. For [action types] we reconcile against [system] every [period]. The last report is attached."
    },
    {
      "id": "TMP-01",
      "question": "Are agent action records protected so that any edit, deletion, reordering or truncation after the fact is detectable?",
      "status": "",
      "answer": "",
      "evidence_links": [],
      "template_answer": "Action records are append-only and hash-chained: each record includes the hash of the previous one. Records are signed with [Ed25519 / P-256] keys held in [KMS / HSM], separate from the people who run the agent. Every [period] we commit a digest of the latest segment [to an external log / to you], so truncation is also detectable. Key management is documented in [document]."
    },
    {
      "id": "TMP-02",
      "question": "Can we, our auditor or our regulator verify those records ourselves, without access to your systems and without relying on your word?",
      "status": "",
      "answer": "",
      "evidence_links": [],
      "template_answer": "You can verify records yourself. We export a bundle for any period; you run [verifier, e.g. an open-source CLI] offline against it with our published public key [key ID]. Segment digests are also anchored in [external log / your storage], so we cannot rewrite history without detection. A sample bundle, the verification steps and a tampered example that fails are attached."
    },
    {
      "id": "TMP-03",
      "question": "Who at your company can read, change or delete agent records, and is that access itself logged?",
      "status": "",
      "answer": "",
      "evidence_links": [],
      "template_answer": "Access to record storage is limited to [roles, number of people]; access to signing keys to [roles]. Every access is logged against an individual identity and reviewed [frequency]. People who operate the agent cannot change records or keys. The latest access review is attached."
    },
    {
      "id": "INC-01",
      "question": "After an incident, can you reconstruct exactly what the agent did, in which of our systems, under which identity, and in what order?",
      "status": "",
      "answer": "",
      "evidence_links": [],
      "template_answer": "For any time window or case we can export every agent action across [systems], in order, with identity, scope, inputs and system responses. The hash chain shows the sequence is complete and unaltered. In our last tabletop on [date], a full reconstruction took [time]."
    },
    {
      "id": "INC-02",